{
 "schema": "rtm-assign-1.0",
 "tool_version": "0.3.1",
 "program": "L2MN-DEMO",
 "country": "MN",
 "round": 5,
 "enumerator_id": "E01",
 "generated_by": "L01",
 "generated_at": "2026-10-23T16:05:00+08:00",
 "rule": {
  "name": "keep_same",
  "rotation_share": 0.1,
  "hard_to_reach": "missed_with_full_cap_or_request",
  "fallback": "random",
  "seed": 20261027
 },
 "replacement_policy": {
  "active": true,
  "triggers": [
   "REFUSAL_HARD",
   "ALL_NUMBERS_DEAD"
  ]
 },
 "synthetic": true,
 "note": "SYNTHETIC sample for trying the tool. No real household, name or phone number.",
 "calendar": {
  "window_start": "2026-10-26",
  "window_end": "2026-11-20",
  "working_weekdays": [
   1,
   2,
   3,
   4,
   5,
   6
  ],
  "call_hours": {
   "start": 9,
   "end": 21
  },
  "time_zone": "Asia/Ulaanbaatar",
  "holidays": [
   {
    "date": "2026-11-10",
    "name": "Genghis Khan's Birthday",
    "estimated": false,
    "working": false
   }
  ],
  "dial_cap": 8,
  "day_list": 7
 },
 "households": [
  {
   "hhid": "0101-003",
   "psu": "0101",
   "stratum": "1",
   "contact": {
    "name": "Contact 0101-003 (synthetic)",
    "phones": [
     {
      "slot": 1,
      "number": "+000 01003 1203",
      "label": "respondent",
      "last_status": "COMPLETE"
     }
    ]
   },
   "history": {
    "joined_round": 1,
    "last_interview": {
     "round": 4,
     "date": "2026-10-01",
     "hour": 20
    },
    "last3": [
     true,
     true,
     true
    ],
    "last_enumerator": "E03"
   },
   "assignment": {
    "reason": "enumerator_unavailable",
    "previous_enumerator": "E03"
   },
   "plan": {
    "first_dial_date": "2026-10-27",
    "target_hour": 20
   },
   "replacements": [
    {
     "hhid": "0101-103",
     "rank": 1,
     "contact": {
      "name": "Reserve 0101-103 (synthetic)",
      "phones": [
       {
        "slot": 1,
        "number": "+000 01103 1596",
        "label": "respondent"
       }
      ]
     }
    }
   ]
  },
  {
   "hhid": "0101-006",
   "psu": "0101",
   "stratum": "1",
   "contact": {
    "name": "Contact 0101-006 (synthetic)",
    "phones": [
     {
      "slot": 1,
      "number": "+000 01006 1180",
      "label": "respondent",
      "last_status": "COMPLETE"
     },
     {
      "slot": 2,
      "number": "+000 01006 2846",
      "label": "spouse"
     },
     {
      "slot": 3,
      "number": "+000 01006 3543",
      "label": "son or daughter"
     }
    ]
   },
   "history": {
    "joined_round": 1,
    "last_interview": {
     "round": 4,
     "date": "2026-10-06",
     "hour": 18
    },
    "last3": [
     false,
     true,
     true
    ],
    "last_enumerator": "E01"
   },
   "assignment": {
    "reason": "keep"
   },
   "plan": {
    "first_dial_date": "2026-11-02",
    "target_hour": 18
   }
  },
  {
   "hhid": "0101-007",
   "psu": "0101",
   "stratum": "1",
   "contact": {
    "name": "Contact 0101-007 (synthetic)",
    "phones": [
     {
      "slot": 1,
      "number": "+000 01007 1606",
      "label": "respondent",
      "last_status": "NOT_AVAILABLE"
     }
    ]
   },
   "history": {
    "joined_round": 1,
    "last_interview": {
     "round": 3,
     "date": "2026-09-01",
     "hour": 10
    },
    "last3": [
     true,
     true,
     false
    ],
    "last_enumerator": "E03"
   },
   "assignment": {
    "reason": "enumerator_unavailable",
    "previous_enumerator": "E03"
   },
   "plan": {
    "first_dial_date": "2026-10-27",
    "target_hour": 10
   }
  },
  {
   "hhid": "0102-004",
   "psu": "0102",
   "stratum": "1",
   "contact": {
    "name": "Contact 0102-004 (synthetic)",
    "phones": [
     {
      "slot": 1,
      "number": "+000 02004 1773",
      "label": "respondent",
      "last_status": "SWITCHED_OFF"
     },
     {
      "slot": 2,
      "number": "+000 02004 2319",
      "label": "spouse"
     },
     {
      "slot": 3,
      "number": "+000 02004 3372",
      "label": "son or daughter"
     }
    ]
   },
   "history": {
    "joined_round": 1,
    "last_interview": {
     "round": 1,
     "date": "2026-07-01",
     "hour": 19
    },
    "last3": [
     false,
     false,
     false
    ],
    "last_enumerator": "E07"
   },
   "assignment": {
    "reason": "switch_hard_to_reach",
    "previous_enumerator": "E07"
   },
   "plan": {
    "first_dial_date": "2026-10-27",
    "target_hour": 19
   }
  },
  {
   "hhid": "0102-005",
   "psu": "0102",
   "stratum": "1",
   "contact": {
    "name": "Contact 0102-005 (synthetic)",
    "phones": [
     {
      "slot": 1,
      "number": "+000 02005 1677",
      "label": "respondent",
      "last_status": "DEAD_NUMBER"
     },
     {
      "slot": 2,
      "number": "+000 02005 2762",
      "label": "spouse",
      "last_status": "COMPLETE"
     },
     {
      "slot": 3,
      "number": "+000 02005 3654",
      "label": "son or daughter"
     }
    ]
   },
   "history": {
    "joined_round": 1,
    "last_interview": {
     "round": 4,
     "date": "2026-10-05",
     "hour": 20
    },
    "last3": [
     false,
     true,
     true
    ],
    "last_enumerator": "E07"
   },
   "assignment": {
    "reason": "rotation",
    "previous_enumerator": "E07"
   },
   "plan": {
    "first_dial_date": "2026-11-02",
    "target_hour": 20
   }
  },
  {
   "hhid": "0102-007",
   "psu": "0102",
   "stratum": "1",
   "contact": {
    "name": "Contact 0102-007 (synthetic)",
    "phones": [
     {
      "slot": 1,
      "number": "+000 02007 1636",
      "label": "respondent",
      "last_status": "DEAD_NUMBER"
     },
     {
      "slot": 2,
      "number": "+000 02007 2869",
      "label": "spouse",
      "last_status": "COMPLETE"
     }
    ]
   },
   "history": {
    "joined_round": 1,
    "last_interview": {
     "round": 4,
     "date": "2026-10-07",
     "hour": 18
    },
    "last3": [
     true,
     true,
     true
    ],
    "last_enumerator": "E01"
   },
   "assignment": {
    "reason": "keep"
   },
   "plan": {
    "first_dial_date": "2026-11-02",
    "target_hour": 18
   }
  },
  {
   "hhid": "0102-008",
   "psu": "0102",
   "stratum": "1",
   "contact": {
    "name": "Contact 0102-008 (synthetic)",
    "phones": [
     {
      "slot": 1,
      "number": "+000 02008 1699",
      "label": "respondent",
      "last_status": "COMPLETE"
     },
     {
      "slot": 2,
      "number": "+000 02008 2474",
      "label": "spouse"
     }
    ]
   },
   "history": {
    "joined_round": 1,
    "last_interview": {
     "round": 4,
     "date": "2026-10-10",
     "hour": 12
    },
    "last3": [
     true,
     true,
     true
    ],
    "last_enumerator": "E01"
   },
   "assignment": {
    "reason": "keep"
   },
   "plan": {
    "first_dial_date": "2026-11-03",
    "target_hour": 12
   }
  },
  {
   "hhid": "0102-009",
   "psu": "0102",
   "stratum": "1",
   "contact": {
    "name": "Contact 0102-009 (synthetic)",
    "phones": [
     {
      "slot": 1,
      "number": "+000 02009 1198",
      "label": "respondent",
      "last_status": "NO_ANSWER"
     },
     {
      "slot": 2,
      "number": "+000 02009 2493",
      "label": "spouse"
     }
    ]
   },
   "history": {
    "joined_round": 1,
    "last3": [
     false,
     false,
     false
    ]
   },
   "assignment": {
    "reason": "switch_hard_to_reach",
    "previous_enumerator": "E02"
   },
   "plan": {
    "first_dial_date": "2026-10-27",
    "target_hour": 14
   }
  },
  {
   "hhid": "0103-003",
   "psu": "0103",
   "stratum": "1",
   "contact": {
    "name": "Contact 0103-003 (synthetic)",
    "phones": [
     {
      "slot": 1,
      "number": "+000 03003 1394",
      "label": "respondent",
      "last_status": "SWITCHED_OFF"
     }
    ]
   },
   "history": {
    "joined_round": 1,
    "last_interview": {
     "round": 2,
     "date": "2026-07-27",
     "hour": 17
    },
    "last3": [
     true,
     false,
     false
    ],
    "last_enumerator": "E03"
   },
   "assignment": {
    "reason": "enumerator_unavailable",
    "previous_enumerator": "E03"
   },
   "plan": {
    "first_dial_date": "2026-10-28",
    "target_hour": 17
   },
   "replacements": [
    {
     "hhid": "0103-103",
     "rank": 1,
     "contact": {
      "name": "Reserve 0103-103 (synthetic)",
      "phones": [
       {
        "slot": 1,
        "number": "+000 03103 1234",
        "label": "respondent"
       }
      ]
     }
    }
   ]
  },
  {
   "hhid": "0103-006",
   "psu": "0103",
   "stratum": "1",
   "contact": {
    "name": "Contact 0103-006 (synthetic)",
    "phones": [
     {
      "slot": 1,
      "number": "+000 03006 1923",
      "label": "respondent",
      "last_status": "REFUSAL_HARD"
     },
     {
      "slot": 2,
      "number": "+000 03006 2445",
      "label": "spouse"
     },
     {
      "slot": 3,
      "number": "+000 03006 3406",
      "label": "son or daughter"
     }
    ]
   },
   "history": {
    "joined_round": 1,
    "last_interview": {
     "round": 1,
     "date": "2026-07-06",
     "hour": 16
    },
    "last3": [
     false,
     false,
     false
    ],
    "last_enumerator": "E03"
   },
   "assignment": {
    "reason": "enumerator_unavailable",
    "previous_enumerator": "E03"
   },
   "plan": {
    "first_dial_date": "2026-11-03",
    "target_hour": 16
   }
  },
  {
   "hhid": "0103-007",
   "psu": "0103",
   "stratum": "1",
   "contact": {
    "name": "Contact 0103-007 (synthetic)",
    "phones": [
     {
      "slot": 1,
      "number": "+000 03007 1726",
      "label": "respondent",
      "last_status": "NO_ANSWER"
     },
     {
      "slot": 2,
      "number": "+000 03007 2953",
      "label": "spouse"
     }
    ]
   },
   "history": {
    "joined_round": 1,
    "last_interview": {
     "round": 2,
     "date": "2026-08-03",
     "hour": 19
    },
    "last3": [
     true,
     false,
     false
    ],
    "last_enumerator": "E03"
   },
   "assignment": {
    "reason": "enumerator_unavailable",
    "previous_enumerator": "E03"
   },
   "plan": {
    "first_dial_date": "2026-11-03",
    "target_hour": 19
   }
  },
  {
   "hhid": "0103-008",